{
  "schemaVersion": "1.0",
  "id": "topo-architecture",
  "title": "How Topocode turns source into an architecture storybook",
  "summary": "Topocode initializes a static diagram home before analysis. Scanning and committed source-grounded stories add evidence and native diagrams to that same navigable shell.",
  "category": "Topocode internals",
  "anchors": [
    { "id": "scan", "path": "packages/scanner/src/typescript-scanner.ts", "symbol": "scanRepository" },
    { "id": "generate", "path": "packages/cli/src/pipeline.ts", "symbol": "generateArtifacts" },
    { "id": "compose", "path": "packages/cli/src/server.ts", "symbol": "composeSiteData" },
    { "id": "serve", "path": "packages/cli/src/server.ts", "symbol": "serveSite" },
    { "id": "parse-story", "path": "packages/story/src/index.ts", "symbol": "parseStoryDocument" },
    { "id": "resolve-story", "path": "packages/story/src/index.ts", "symbol": "resolveStoryDocument" },
    { "id": "render", "path": "packages/diagram-core/src/index.ts", "symbol": "renderStory" },
    { "id": "catalogue", "path": "packages/cli/src/catalogue.ts", "symbol": "buildCatalogue" },
    { "id": "initialize", "path": "packages/cli/src/catalogue.ts", "symbol": "initializeSite" },
    { "id": "home", "path": "packages/cli/src/catalogue.ts", "symbol": "renderCataloguePage" },
    { "id": "bundle", "path": "packages/cli/src/bundle.ts", "symbol": "bundleSite" }
  ],
  "sections": [
    {
      "id": "scan",
      "title": "1. Scan source into a graph",
      "body": "Optional scanning walks supported TypeScript/JavaScript source and produces a deterministic graph of files, modules, and relationships. Initialization and authored stories do not require this graph.",
      "anchorIds": ["scan"]
    },
    {
      "id": "generate",
      "title": "2. Generate site artifacts",
      "body": "The pipeline turns the scanned graph (and any ingested reports) into the site artifacts \u2014 data, layout, and modules \u2014 written under .topo/cache.",
      "anchorIds": ["generate"]
    },
    {
      "id": "serve",
      "title": "3. Preserve generated evidence",
      "body": "One composition contract keeps scanner, graph, layout, report, enrichment, and curated-view data current for command-line validation and future source-grounded capabilities without exposing the retired WebGL explorer.",
      "anchorIds": ["compose", "serve"]
    },
    {
      "id": "story",
      "title": "4. Author a source-grounded story",
      "body": "A story is authored data: it is parsed against a strict contract, then its path/symbol/pattern anchors are resolved to real source locations \u2014 broken anchors fail loudly instead of rendering misleading evidence.",
      "anchorIds": ["parse-story", "resolve-story"]
    },
    {
      "id": "render",
      "title": "5. Render at the pinned boundary",
      "body": "A resolved story is translated to an artifact only at the @topo/diagram-core boundary, through a pinned, integrity-checked viewer \u2014 the renderer is never mutated by authored content.",
      "anchorIds": ["render"]
    },
    {
      "id": "catalogue",
      "title": "6. Browse the storybook",
      "body": "Init creates a truthful unscanned Home without analysis or rendering. Every supported committed story is later gathered into one persistent shell with filtering, grouping, Git-backed sorting, deep links, and a selected real Archify viewer. Home is the inventory; generated Repository exploration is a separate selection in that shell.",
      "anchorIds": ["catalogue", "initialize", "home"]
    },
    {
      "id": "bundle",
      "title": "7. Bundle for static hosting",
      "body": "The composed site \u2014 shell, stories, Archify viewer artifacts, and license notices \u2014 is emitted as deployable static files that any plain file server can host, with no topo process running.",
      "anchorIds": ["bundle"]
    }
  ],
  "connections": [
    { "from": "scan", "to": "generate", "label": "feeds" },
    { "from": "generate", "to": "serve", "label": "composed by" },
    { "from": "story", "to": "render", "label": "rendered by" },
    { "from": "render", "to": "catalogue", "label": "listed in" },
    { "from": "serve", "to": "catalogue", "label": "entry in" },
    { "from": "catalogue", "to": "bundle", "label": "bundled by" }
  ]
}
