{
  "schemaVersion": "1.0",
  "diagramFamily": "dataflow",
  "classification": "source-grounded",
  "id": "repository-dataflow",
  "title": "How repository source becomes a static Topocode site",
  "summary": "Follow repository files through scanning, graph composition, generated layout and site artifacts, and the validated static bundle.",
  "category": "Topocode internals",
  "anchors": [
    {
      "id": "scan-source",
      "path": "packages/scanner/src/typescript-scanner.ts",
      "symbol": "scanRepository",
      "pattern": "const files = await walkFiles(options.root);"
    },
    {
      "id": "emit-graph",
      "path": "packages/scanner/src/typescript-scanner.ts",
      "symbol": "scanRepository",
      "pattern": "return { graph, logicalArchitecture, diagnostics, metrics, authoritative };"
    },
    {
      "id": "compose-graph",
      "path": "packages/cli/src/pipeline.ts",
      "symbol": "generateArtifacts",
      "pattern": "const composedGraph = composeConfiguredGraph(graph, config.modules);"
    },
    {
      "id": "generate-site",
      "path": "packages/cli/src/pipeline.ts",
      "symbol": "generateArtifacts",
      "pattern": "await writeGenerated(root, \"cache/site/data.json\", data);"
    },
    {
      "id": "bundle-site",
      "path": "packages/cli/src/bundle.ts",
      "symbol": "bundleSite",
      "pattern": "await cp(sourceDirectory, stagedSite, { recursive: true });"
    }
  ],
  "sections": [
    {
      "id": "repository-source",
      "title": "Repository source",
      "body": "Repository files.",
      "anchorIds": ["scan-source"]
    },
    {
      "id": "scan-compose",
      "title": "Scan and compose",
      "body": "Composed graph.",
      "anchorIds": ["emit-graph", "compose-graph"]
    },
    {
      "id": "site-artifacts",
      "title": "Generated artifacts",
      "body": "Graph, layout, and site.",
      "anchorIds": ["generate-site"]
    },
    {
      "id": "static-bundle",
      "title": "Static site bundle",
      "body": "Validated static files.",
      "anchorIds": ["bundle-site"]
    }
  ],
  "connections": [
    {
      "from": "repository-source",
      "to": "scan-compose",
      "label": "scans and composes"
    },
    {
      "from": "scan-compose",
      "to": "site-artifacts",
      "label": "derives artifacts"
    },
    {
      "from": "site-artifacts",
      "to": "static-bundle",
      "label": "copies static files"
    }
  ]
}
